Query,Response,Time_taken
Can you tell me how to split my investments?,"{'answer': 'To achieve investment diversification, include a variety of assets such as stocks, bond mutual funds, real estate, and collectibles like rare coins. However, the specific way to split your investments depends on individual needs and goals.'}",0:00:11.770981
Can you tell me how to split my investments?,"{'answer': 'To achieve investment diversification, include a variety of assets such as stocks, bond mutual funds, real estate, and collectibles like rare coins. However, the specific way to split your investments depends on individual needs and goals.'}",0:00:37.718936
What is personal financial planning?,"{'answer': 'Personal financial planning is the process of managing your money to achieve personal economic satisfaction, involving decisions about spending, financing, and investing to optimize your financial situation.'}",0:00:36.274341
Why is financial planning important?,"{'answer': 'Financial planning is crucial as it ensures budgeting, provides direction for future goals, improves decision-making regarding spending and investments, and enhances net worth. It also prepares individuals to meet life events financially.'}",0:00:30.944717
What are the key steps in the financial planning process?,"{'answer': 'The key steps in the financial planning process include defining goals, assessing the current situation, identifying choices, evaluating those choices, and finally choosing.'}",0:00:28.218979
How much should I save for emergencies?,"{'answer': 'It is recommended to have three to six months of living expenses saved, but aiming to stash away at least $1,000 is a good starting point. Keep the money easily accessible.'}",0:00:56.427982
How can I pay off debt effectively?,"{'answer': 'To pay off debt effectively, consider consolidating loans for lower interest rates, limiting credit card usage to one or two major cards, and focusing on high-interest debts first. Paying off debt provides a significant return on investment compared to other savings options. Additionally, creating a budget plan can help manage monthly payments within affordable limits.'}",0:00:54.758190
How should I plan for retirement?,"{'answer': ""To plan for retirement, consider integrating personalized income plans into your overall strategy and account for factors like caring for elderly parents or consolidating financial accounts. Set clear goals such as saving enough from a 401(k) for family trips every three years while using Social Security benefits primarily for living needs. It's never too late to start, so define your retirement vision and begin saving accordingly.""}",0:01:17.265305
Do I need a financial planner?,"{'answer': 'Whether you need a financial planner depends on your individual needs and circumstances. If you have complex financial goals, debts to manage, or lack experience in financial planning, consulting a professional can be beneficial. However, if you are comfortable making decisions about investments and savings after consultation with a professional, working solely on an advisory basis may suffice.'}",0:00:56.861803
How often should I review my financial plan?,"{'answer': 'You should regularly assess your financial decisions, ideally doing a complete review of your finances at least once a year. However, changing personal, social, and economic factors may require more frequent assessments.'}",0:00:54.613455
What should I consider when planning for my child's education?,"{'answer': ""When planning for your child's education, you should evaluate all education funding options that both you and your child can take advantage of, from savings plans to scholarships. Consider real numbers for each type of school your child may attend, and encourage them to save their allowance or birthday money.""}",0:00:45.718405
How can I improve my credit score?,"{'answer': 'To improve your credit score, pay bills on time and in full, avoid using all available credit, limit new lines of credit, prioritize debt repayment starting from bad debts, understand different types of credit, and consider debt consolidation if it meets certain criteria.'}",0:00:40.344772
what is debt consolidation?,"{'answer': 'Debt consolidation is a process that involves taking out a new loan to pay off multiple existing debts, often resulting in lower overall interest rates and simplified monthly payments.'}",0:00:42.767275
what is debt consolidation?,"{'answer': 'Debt consolidation is a process that involves taking out a new loan to pay off multiple existing debts, often resulting in lower overall interest rates and simplified monthly payments.'}",0:01:09.442106
